{
  "$schema": "http://json-schema.org/draft-07/schema#",
  "title": "Edit Operation Rules SSOT",
  "description": "Single-source-of-truth rules for canonical edit paths, validation, and handler table generation.",
  "type": "object",
  "required": [
    "version",
    "simple_rules",
    "runtime_fields",
    "nested_rules",
    "validation_rules"
  ],
  "properties": {
    "version": {
      "type": "integer",
      "minimum": 1
    },
    "simple_rules": {
      "type": "array",
      "items": { "$ref": "#/definitions/simpleFieldRule" },
      "minItems": 1
    },
    "runtime_fields": {
      "type": "array",
      "items": { "$ref": "#/definitions/runtimeFieldRule" },
      "minItems": 1
    },
    "nested_rules": {
      "type": "array",
      "items": { "$ref": "#/definitions/nestedRootRule" },
      "minItems": 1
    },
    "validation_rules": {
      "type": "array",
      "items": { "$ref": "#/definitions/fieldValidationRule" }
    }
  },
  "additionalProperties": false,
  "definitions": {
    "nestedRootRule": {
      "type": "object",
      "required": ["artifact", "root", "content_path", "node"],
      "properties": {
        "artifact": {
          "type": "string",
          "enum": ["rfc", "adr", "work", "guard", "conformance"]
        },
        "root": {
          "type": "string",
          "pattern": "^[a-z_][a-z0-9_]*$"
        },
        "content_path": {
          "type": "array",
          "items": {
            "type": "string",
            "pattern": "^[a-z_][a-z0-9_]*$"
          },
          "minItems": 1
        },
        "node": { "$ref": "#/definitions/nestedNodeRule" }
      },
      "additionalProperties": false
    },
    "nestedFieldRule": {
      "type": "object",
      "required": ["name", "node"],
      "properties": {
        "name": {
          "type": "string",
          "pattern": "^[a-z_][a-z0-9_]*$"
        },
        "node": { "$ref": "#/definitions/nestedNodeRule" }
      },
      "additionalProperties": false
    },
    "nestedNodeRule": {
      "oneOf": [
        {
          "type": "object",
          "required": ["kind", "verbs"],
          "properties": {
            "kind": { "type": "string", "enum": ["scalar"] },
            "verbs": {
              "type": "array",
              "items": {
                "type": "string",
                "enum": ["get", "set", "add", "remove", "tick"]
              },
              "minItems": 1
            },
            "set_mode": {
              "oneOf": [
                { "$ref": "#/definitions/runtimeSetMode" },
                { "type": "null" }
              ]
            }
          },
          "additionalProperties": false
        },
        {
          "type": "object",
          "required": ["kind", "verbs", "fields"],
          "properties": {
            "kind": { "type": "string", "enum": ["object"] },
            "verbs": {
              "type": "array",
              "items": {
                "type": "string",
                "enum": ["get", "set", "add", "remove", "tick"]
              },
              "minItems": 1
            },
            "set_mode": {
              "oneOf": [
                { "type": "string", "enum": ["acceptance_criterion"] },
                { "type": "null" }
              ]
            },
            "fields": {
              "type": "array",
              "items": { "$ref": "#/definitions/nestedFieldRule" }
            }
          },
          "additionalProperties": false
        },
        {
          "type": "object",
          "required": ["kind", "verbs", "item"],
          "properties": {
            "kind": { "type": "string", "enum": ["list"] },
            "verbs": {
              "type": "array",
              "items": {
                "type": "string",
                "enum": ["get", "set", "add", "remove", "tick"]
              },
              "minItems": 1
            },
            "text_key": {
              "oneOf": [
                { "type": "string", "pattern": "^[a-z_][a-z0-9_]*$" },
                { "type": "null" }
              ]
            },
            "value_codec": {
              "oneOf": [
                { "type": "string", "enum": ["requirement_binding"] },
                { "type": "null" }
              ]
            },
            "item": { "$ref": "#/definitions/nestedNodeRule" }
          },
          "additionalProperties": false
        }
      ]
    },
    "simpleFieldRule": {
      "type": "object",
      "required": ["artifact", "name", "kind", "verbs"],
      "properties": {
        "artifact": {
          "type": "string",
          "enum": ["rfc", "clause", "adr", "work", "guard", "conformance"]
        },
        "name": {
          "type": "string",
          "pattern": "^[a-z_][a-z0-9_]*$"
        },
        "kind": {
          "type": "string",
          "enum": ["scalar", "list"]
        },
        "verbs": {
          "type": "array",
          "items": {
            "type": "string",
            "enum": ["get", "set", "add", "remove", "tick"]
          },
          "minItems": 1
        }
      },
      "additionalProperties": false
    },
    "runtimeFieldRule": {
      "type": "object",
      "required": ["artifact", "name", "get", "set", "list_path"],
      "properties": {
        "artifact": {
          "type": "string",
          "enum": ["rfc", "clause", "adr", "work", "guard", "conformance"]
        },
        "name": {
          "type": "string",
          "pattern": "^[a-z_][a-z0-9_]*$"
        },
        "get": {
          "oneOf": [
            { "$ref": "#/definitions/runtimeGetRule" },
            { "type": "null" }
          ]
        },
        "set": {
          "oneOf": [
            { "$ref": "#/definitions/runtimeSetRule" },
            { "type": "null" }
          ]
        },
        "list_path": {
          "oneOf": [
            {
              "type": "array",
              "items": {
                "type": "string",
                "pattern": "^[a-z_][a-z0-9_]*$"
              },
              "minItems": 1
            },
            { "type": "null" }
          ]
        }
      },
      "additionalProperties": false
    },
    "runtimeGetRule": {
      "type": "object",
      "required": ["path", "render"],
      "properties": {
        "path": {
          "type": "array",
          "items": {
            "type": "string",
            "pattern": "^[a-z_][a-z0-9_]*$"
          },
          "minItems": 1
        },
        "render": {
          "type": "string",
          "enum": [
            "scalar",
            "csv_strings",
            "line_strings",
            "text_lines",
            "status_lines"
          ]
        },
        "status_key": {
          "type": "string",
          "pattern": "^[a-z_][a-z0-9_]*$"
        },
        "text_key": {
          "type": "string",
          "pattern": "^[a-z_][a-z0-9_]*$"
        }
      },
      "additionalProperties": false
    },
    "runtimeSetRule": {
      "type": "object",
      "required": ["path", "mode"],
      "properties": {
        "path": {
          "type": "array",
          "items": {
            "type": "string",
            "pattern": "^[a-z_][a-z0-9_]*$"
          },
          "minItems": 1
        },
        "mode": {
          "$ref": "#/definitions/runtimeSetMode"
        }
      },
      "additionalProperties": false
    },
    "runtimeSetMode": {
      "oneOf": [
        {
          "type": "object",
          "required": ["type"],
          "properties": {
            "type": { "type": "string", "enum": ["string"] }
          },
          "additionalProperties": false
        },
        {
          "type": "object",
          "required": ["type"],
          "properties": {
            "type": { "type": "string", "enum": ["non_empty_string"] }
          },
          "additionalProperties": false
        },
        {
          "type": "object",
          "required": ["type"],
          "properties": {
            "type": { "type": "string", "enum": ["integer"] }
          },
          "additionalProperties": false
        },
        {
          "type": "object",
          "required": ["type"],
          "properties": {
            "type": { "type": "string", "enum": ["semver"] }
          },
          "additionalProperties": false
        },
        {
          "type": "object",
          "required": ["type", "allowed", "invalid_msg", "code"],
          "properties": {
            "type": { "type": "string", "enum": ["enum"] },
            "allowed": {
              "type": "array",
              "items": { "type": "string" },
              "minItems": 1
            },
            "invalid_msg": { "type": "string", "minLength": 1 },
            "code": {
              "oneOf": [
                { "type": "string", "pattern": "^E[0-9A-Za-z_]+$" },
                { "type": "null" }
              ]
            }
          },
          "additionalProperties": false
        }
      ]
    },
    "fieldValidationRule": {
      "type": "object",
      "required": ["artifact", "field", "rule"],
      "properties": {
        "artifact": {
          "type": "string",
          "enum": ["rfc", "clause", "adr", "work", "guard", "conformance"]
        },
        "field": {
          "type": "string",
          "pattern": "^[a-z_][a-z0-9_]*$"
        },
        "rule": {
          "type": "string",
          "enum": [
            "semver",
            "clause_superseded_by",
            "artifact_ref",
            "enum_value"
          ]
        }
      },
      "additionalProperties": false
    }
  }
}
