{
  "version": 3,
  "simple_rules": [
    {
      "artifact": "clause",
      "name": "text",
      "kind": "scalar",
      "verbs": ["get", "set"]
    },
    {
      "artifact": "clause",
      "name": "title",
      "kind": "scalar",
      "verbs": ["get", "set"]
    },
    {
      "artifact": "clause",
      "name": "status",
      "kind": "scalar",
      "verbs": ["get"]
    },
    {
      "artifact": "clause",
      "name": "kind",
      "kind": "scalar",
      "verbs": ["get", "set"]
    },
    {
      "artifact": "clause",
      "name": "superseded_by",
      "kind": "scalar",
      "verbs": ["get"]
    },
    {
      "artifact": "clause",
      "name": "since",
      "kind": "scalar",
      "verbs": ["get"]
    },
    {
      "artifact": "clause",
      "name": "anchors",
      "kind": "list",
      "verbs": ["add", "remove"]
    },
    {
      "artifact": "clause",
      "name": "tags",
      "kind": "list",
      "verbs": ["add", "remove", "get"]
    },

    {
      "artifact": "rfc",
      "name": "status",
      "kind": "scalar",
      "verbs": ["get"]
    },
    {
      "artifact": "rfc",
      "name": "phase",
      "kind": "scalar",
      "verbs": ["get"]
    },
    {
      "artifact": "rfc",
      "name": "title",
      "kind": "scalar",
      "verbs": ["get", "set"]
    },
    {
      "artifact": "rfc",
      "name": "version",
      "kind": "scalar",
      "verbs": ["get"]
    },
    {
      "artifact": "rfc",
      "name": "owners",
      "kind": "list",
      "verbs": ["get", "add", "remove"]
    },
    {
      "artifact": "rfc",
      "name": "refs",
      "kind": "list",
      "verbs": ["get", "add", "remove"]
    },
    {
      "artifact": "rfc",
      "name": "tags",
      "kind": "list",
      "verbs": ["add", "remove", "get"]
    },
    {
      "artifact": "rfc",
      "name": "supersedes",
      "kind": "scalar",
      "verbs": ["get"]
    },
    {
      "artifact": "rfc",
      "name": "created",
      "kind": "scalar",
      "verbs": ["get"]
    },
    {
      "artifact": "rfc",
      "name": "updated",
      "kind": "scalar",
      "verbs": ["get"]
    },

    {
      "artifact": "adr",
      "name": "status",
      "kind": "scalar",
      "verbs": ["get"]
    },
    {
      "artifact": "adr",
      "name": "title",
      "kind": "scalar",
      "verbs": ["get", "set"]
    },
    {
      "artifact": "adr",
      "name": "date",
      "kind": "scalar",
      "verbs": ["get", "set"]
    },
    {
      "artifact": "adr",
      "name": "superseded_by",
      "kind": "scalar",
      "verbs": ["get"]
    },
    {
      "artifact": "adr",
      "name": "refs",
      "kind": "list",
      "verbs": ["get", "add", "remove"]
    },
    {
      "artifact": "adr",
      "name": "tags",
      "kind": "list",
      "verbs": ["add", "remove", "get"]
    },
    {
      "artifact": "adr",
      "name": "context",
      "kind": "scalar",
      "verbs": ["get", "set"]
    },
    {
      "artifact": "adr",
      "name": "decision",
      "kind": "scalar",
      "verbs": ["get", "set"]
    },
    {
      "artifact": "adr",
      "name": "consequences",
      "kind": "scalar",
      "verbs": ["get", "set"]
    },
    {
      "artifact": "adr",
      "name": "alternatives",
      "kind": "list",
      "verbs": ["get", "add", "remove", "tick"]
    },

    {
      "artifact": "work",
      "name": "status",
      "kind": "scalar",
      "verbs": ["get"]
    },
    {
      "artifact": "work",
      "name": "title",
      "kind": "scalar",
      "verbs": ["get", "set"]
    },
    {
      "artifact": "work",
      "name": "started",
      "kind": "scalar",
      "verbs": ["get"]
    },
    {
      "artifact": "work",
      "name": "completed",
      "kind": "scalar",
      "verbs": ["get"]
    },
    {
      "artifact": "work",
      "name": "refs",
      "kind": "list",
      "verbs": ["get", "add", "remove"]
    },
    {
      "artifact": "work",
      "name": "depends_on",
      "kind": "list",
      "verbs": ["get", "add", "remove"]
    },
    {
      "artifact": "work",
      "name": "tags",
      "kind": "list",
      "verbs": ["add", "remove", "get"]
    },
    {
      "artifact": "work",
      "name": "description",
      "kind": "scalar",
      "verbs": ["get", "set"]
    },
    {
      "artifact": "work",
      "name": "acceptance_criteria",
      "kind": "list",
      "verbs": ["get", "add", "remove", "tick"]
    },
    {
      "artifact": "work",
      "name": "notes",
      "kind": "list",
      "verbs": ["get", "add", "remove"]
    },

    {
      "artifact": "guard",
      "name": "title",
      "kind": "scalar",
      "verbs": ["get", "set"]
    },
    {
      "artifact": "guard",
      "name": "refs",
      "kind": "list",
      "verbs": ["get", "add", "remove"]
    },
    {
      "artifact": "guard",
      "name": "tags",
      "kind": "list",
      "verbs": ["add", "remove", "get"]
    },
    {
      "artifact": "guard",
      "name": "command",
      "kind": "scalar",
      "verbs": ["get", "set"]
    },
    {
      "artifact": "guard",
      "name": "timeout_secs",
      "kind": "scalar",
      "verbs": ["get", "set"]
    },
    {
      "artifact": "guard",
      "name": "pattern",
      "kind": "scalar",
      "verbs": ["get", "set"]
    },

    {
      "artifact": "conformance",
      "name": "title",
      "kind": "scalar",
      "verbs": ["get", "set"]
    },
    {
      "artifact": "conformance",
      "name": "path",
      "kind": "scalar",
      "verbs": ["get", "set"]
    },
    {
      "artifact": "conformance",
      "name": "selector",
      "kind": "scalar",
      "verbs": ["get", "set"]
    },
    {
      "artifact": "conformance",
      "name": "guards",
      "kind": "list",
      "verbs": ["get", "add", "remove"]
    },
    {
      "artifact": "conformance",
      "name": "tags",
      "kind": "list",
      "verbs": ["get", "add", "remove"]
    }
  ],
  "runtime_fields": [
    {
      "artifact": "rfc",
      "name": "status",
      "get": { "path": ["status"], "render": "scalar" },
      "set": null,
      "list_path": null
    },
    {
      "artifact": "rfc",
      "name": "phase",
      "get": { "path": ["phase"], "render": "scalar" },
      "set": null,
      "list_path": null
    },
    {
      "artifact": "rfc",
      "name": "title",
      "get": { "path": ["title"], "render": "scalar" },
      "set": { "path": ["title"], "mode": { "type": "string" } },
      "list_path": null
    },
    {
      "artifact": "rfc",
      "name": "version",
      "get": { "path": ["version"], "render": "scalar" },
      "set": null,
      "list_path": null
    },
    {
      "artifact": "rfc",
      "name": "owners",
      "get": { "path": ["owners"], "render": "csv_strings" },
      "set": null,
      "list_path": ["owners"]
    },
    {
      "artifact": "rfc",
      "name": "refs",
      "get": { "path": ["refs"], "render": "csv_strings" },
      "set": null,
      "list_path": ["refs"]
    },
    {
      "artifact": "rfc",
      "name": "tags",
      "get": { "path": ["tags"], "render": "csv_strings" },
      "set": null,
      "list_path": ["tags"]
    },
    {
      "artifact": "rfc",
      "name": "supersedes",
      "get": { "path": ["supersedes"], "render": "scalar" },
      "set": null,
      "list_path": null
    },
    {
      "artifact": "rfc",
      "name": "created",
      "get": { "path": ["created"], "render": "scalar" },
      "set": null,
      "list_path": null
    },
    {
      "artifact": "rfc",
      "name": "updated",
      "get": { "path": ["updated"], "render": "scalar" },
      "set": null,
      "list_path": null
    },

    {
      "artifact": "clause",
      "name": "text",
      "get": { "path": ["text"], "render": "scalar" },
      "set": { "path": ["text"], "mode": { "type": "string" } },
      "list_path": null
    },
    {
      "artifact": "clause",
      "name": "title",
      "get": { "path": ["title"], "render": "scalar" },
      "set": { "path": ["title"], "mode": { "type": "string" } },
      "list_path": null
    },
    {
      "artifact": "clause",
      "name": "status",
      "get": { "path": ["status"], "render": "scalar" },
      "set": null,
      "list_path": null
    },
    {
      "artifact": "clause",
      "name": "kind",
      "get": { "path": ["kind"], "render": "scalar" },
      "set": {
        "path": ["kind"],
        "mode": {
          "type": "enum",
          "allowed": ["normative", "informative"],
          "invalid_msg": "Invalid kind value",
          "code": "E0201ClauseSchemaInvalid"
        }
      },
      "list_path": null
    },
    {
      "artifact": "clause",
      "name": "superseded_by",
      "get": { "path": ["superseded_by"], "render": "scalar" },
      "set": null,
      "list_path": null
    },
    {
      "artifact": "clause",
      "name": "since",
      "get": { "path": ["since"], "render": "scalar" },
      "set": null,
      "list_path": null
    },
    {
      "artifact": "clause",
      "name": "anchors",
      "get": null,
      "set": null,
      "list_path": ["anchors"]
    },
    {
      "artifact": "clause",
      "name": "tags",
      "get": { "path": ["tags"], "render": "csv_strings" },
      "set": null,
      "list_path": ["tags"]
    },

    {
      "artifact": "adr",
      "name": "status",
      "get": { "path": ["govctl", "status"], "render": "scalar" },
      "set": null,
      "list_path": null
    },
    {
      "artifact": "adr",
      "name": "title",
      "get": { "path": ["govctl", "title"], "render": "scalar" },
      "set": { "path": ["govctl", "title"], "mode": { "type": "string" } },
      "list_path": null
    },
    {
      "artifact": "adr",
      "name": "date",
      "get": { "path": ["govctl", "date"], "render": "scalar" },
      "set": { "path": ["govctl", "date"], "mode": { "type": "string" } },
      "list_path": null
    },
    {
      "artifact": "adr",
      "name": "superseded_by",
      "get": { "path": ["govctl", "superseded_by"], "render": "scalar" },